{
  "generated_at": "2026-08-26T00:00:00+09:00",
  "pages": [
    {
      "assignments": [
        {
          "classification": "PRESERVATION",
          "line_number": 1,
          "line_sha256": "9839383EA31329FF9858241147CE4D6338C955741BFC5958925840FBDC6CBF15",
          "record_id": "PRESERVE-WPUJAC104DWH-P004-L001-L023"
        },
        {
          "classification": "PRESERVATION",
          "line_number": 2,
          "line_sha256": "28604B507FB664C942379D69CBF10256BF4ABDC9338EEE95D2CCC10E87561B85",
          "record_id": "PRESERVE-WPUJAC104DWH-P004-L001-L023"
        },
        {
          "classification": "PRESERVATION",
          "line_number": 3,
          "line_sha256": "A6755D8428F9130A935299154965AD2D0305D799B32B90D893FC347CDB5E9D93",
          "record_id": "PRESERVE-WPUJAC104DWH-P004-L001-L023"
        },
        {
          "classification": "PRESERVATION",
          "line_number": 4,
          "line_sha256": "2AD16FFAC8A99E6A4DE574E4818A6DE08D9704C672BFAE73EC286591FB3F000E",
          "record_id": "PRESERVE-WPUJAC104DWH-P004-L001-L023"
        },
        {
          "classification": "PRESERVATION",
          "line_number": 5,
          "line_sha256": "B4637CBEB620167917FAAD055693A8F370C3B038955DCFD9AFD66DD40D212576",
          "record_id": "PRESERVE-WPUJAC104DWH-P004-L001-L023"
        },
        {
          "classification": "PRESERVATION",
          "line_number": 6,
          "line_sha256": "057DFB91FB1D717C5CFAF529AF1FA152FD90276A40F3FB915BF69CE624596610",
          "record_id": "PRESERVE-WPUJAC104DWH-P004-L001-L023"
        },
        {
          "classification": "PRESERVATION",
          "line_number": 7,
          "line_sha256": "A22B09B7737BB27038CDCDB6DC937F93F11B1B179CCCF93934FBE2C88E4D0C3D",
          "record_id": "PRESERVE-WPUJAC104DWH-P004-L001-L023"
        },
        {
          "classification": "PRESERVATION",
          "line_number": 8,
          "line_sha256": "B6BE5BD0B70C1C3367A1E0451BC7D084C6D007B823D6B91696565743A442F429",
          "record_id": "PRESERVE-WPUJAC104DWH-P004-L001-L023"
        },
        {
          "classification": "PRESERVATION",
          "line_number": 9,
          "line_sha256": "A320EB9A7275712979D2EE6EC8B3BA8581F298B414E0FF5D407E9F60FDEE69A9",
          "record_id": "PRESERVE-WPUJAC104DWH-P004-L001-L023"
        },
        {
          "classification": "PRESERVATION",
          "line_number": 10,
          "line_sha256": "2B46C85079DB05F1270C6A57310A16DFF098BB26671BD0166AAFA0F6A4165F1B",
          "record_id": "PRESERVE-WPUJAC104DWH-P004-L001-L023"
        },
        {
          "classification": "PRESERVATION",
          "line_number": 11,
          "line_sha256": "429815332214E2B0E7BBD5A44F20E52DD795FE47B4186F126F5C646E5745B134",
          "record_id": "PRESERVE-WPUJAC104DWH-P004-L001-L023"
        },
        {
          "classification": "PRESERVATION",
          "line_number": 12,
          "line_sha256": "7E0CAF28AC2E32FBDC2DF17D6FB33B7C23C17D98AB8842331033A706AA0A97AE",
          "record_id": "PRESERVE-WPUJAC104DWH-P004-L001-L023"
        },
        {
          "classification": "PRESERVATION",
          "line_number": 13,
          "line_sha256": "647CB4AB03C44F2C1F8AB86A578517523889C26969D9FDA75E1EB6FD730AB786",
          "record_id": "PRESERVE-WPUJAC104DWH-P004-L001-L023"
        },
        {
          "classification": "PRESERVATION",
          "line_number": 14,
          "line_sha256": "5D35FB9FF1746E0C5DFA5022B10E890FCC9EE7F2E20DE4DD4D8CC3E7F6062B15",
          "record_id": "PRESERVE-WPUJAC104DWH-P004-L001-L023"
        },
        {
          "classification": "PRESERVATION",
          "line_number": 15,
          "line_sha256": "D17C0EB5E122B50A3723146EE9F884BBEB7319705BB4D92C5B24B706A6B0DCC6",
          "record_id": "PRESERVE-WPUJAC104DWH-P004-L001-L023"
        },
        {
          "classification": "PRESERVATION",
          "line_number": 16,
          "line_sha256": "8F85EE7A1C6A6D54A9FCFE87F557381EEF7C1210EC87258CCDA50251BFA105E9",
          "record_id": "PRESERVE-WPUJAC104DWH-P004-L001-L023"
        },
        {
          "classification": "PRESERVATION",
          "line_number": 17,
          "line_sha256": "15D1FB3DDA641B5A21D2319F82626A12F793727095E360EDBB360D6C9DC03D3C",
          "record_id": "PRESERVE-WPUJAC104DWH-P004-L001-L023"
        },
        {
          "classification": "PRESERVATION",
          "line_number": 18,
          "line_sha256": "69DCB403F67EA4AD3C09E1F24542DDE6019479F7A0A18B46DDF3FB188EDAB525",
          "record_id": "PRESERVE-WPUJAC104DWH-P004-L001-L023"
        },
        {
          "classification": "PRESERVATION",
          "line_number": 19,
          "line_sha256": "ACDC211F38A4EFF9CC83792AAEE50885130C8992B6A34E1470B126381AFA13E8",
          "record_id": "PRESERVE-WPUJAC104DWH-P004-L001-L023"
        },
        {
          "classification": "PRESERVATION",
          "line_number": 20,
          "line_sha256": "4CD566BE30C066BC1D0B07607BA63096CC60327D6CEBBDE015559EA0E9DC9B31",
          "record_id": "PRESERVE-WPUJAC104DWH-P004-L001-L023"
        },
        {
          "classification": "PRESERVATION",
          "line_number": 21,
          "line_sha256": "8AABAEF6CDA06A9488ABD5321484BE97D340CC02C2213034D2CCB6D77CE4473F",
          "record_id": "PRESERVE-WPUJAC104DWH-P004-L001-L023"
        },
        {
          "classification": "PRESERVATION",
          "line_number": 22,
          "line_sha256": "4B4E6F5E48758E2374F6E47B1AF3CCBD88C813D41B7B84FE27B5718DC767ADC7",
          "record_id": "PRESERVE-WPUJAC104DWH-P004-L001-L023"
        },
        {
          "classification": "PRESERVATION",
          "line_number": 23,
          "line_sha256": "94FBAB315D2D57EE83B7368063DFFCC1AD11E68891D6A0BA12327E44CEC5DE11",
          "record_id": "PRESERVE-WPUJAC104DWH-P004-L001-L023"
        },
        {
          "classification": "CHILD",
          "line_number": 24,
          "line_sha256": "1B5456AC5BA6B5B5C5DF0D9004BE1941141AC0F34B8394E500D5FD1ACBB28F02",
          "record_id": "CHILD-WPUJAC104DWH-P004-SPRAY-FIRE-PREVENTION-001"
        },
        {
          "classification": "CHILD",
          "line_number": 25,
          "line_sha256": "D49323C11E06069F9F856DBE50EC614B4027D8606990F308552A3A18207492D2",
          "record_id": "CHILD-WPUJAC104DWH-P004-SPRAY-FIRE-PREVENTION-001"
        },
        {
          "classification": "CHILD",
          "line_number": 26,
          "line_sha256": "9A85324BE0FE3FDACC520F1831FF9C3BC9E23D8993885A8AE3F2D35008D6816B",
          "record_id": "CHILD-WPUJAC104DWH-P004-WATER-INGRESS-PREVENTION-001"
        },
        {
          "classification": "CHILD",
          "line_number": 27,
          "line_sha256": "D2CA4EAAEA75F92BE8418F5281B303AC3434D21A2D5B1E0195FF3133E5D8DFFB",
          "record_id": "CHILD-WPUJAC104DWH-P004-WATER-INGRESS-PREVENTION-001"
        },
        {
          "classification": "PRESERVATION",
          "line_number": 28,
          "line_sha256": "6FEB3D5E89D4ADD33B7AF4442DB20DB942558F3D37841395FB9C5F39BE1BD0E1",
          "record_id": "PRESERVE-WPUJAC104DWH-P004-L028-L029"
        },
        {
          "classification": "PRESERVATION",
          "line_number": 29,
          "line_sha256": "B7E1277FAD84A652904583CA4FD462728EF4999FCA473219C092BFD059F940FE",
          "record_id": "PRESERVE-WPUJAC104DWH-P004-L028-L029"
        },
        {
          "classification": "NON_SEARCHABLE_STRUCTURE",
          "line_number": 30,
          "line_sha256": "4B227777D4DD1FC61C6F884F48641D02B4D121D3FD328CB08B5531FCACDABF8A",
          "record_id": "PAGE_NUMBER"
        }
      ],
      "document_id": "MAN-SKMAGIC-WPU-JAC104D-JCC104D-REV00",
      "exact_sales_code": "WPUJAC104DWH",
      "page": 4,
      "total_lines": 30
    },
    {
      "assignments": [
        {
          "classification": "PRESERVATION",
          "line_number": 1,
          "line_sha256": "9F17706A7F26E6E089B94902947C7B9D155F4AFAD000CFBBA8A8991786BBB21B",
          "record_id": "PRESERVE-WPUJAC104DWH-P005-L001-L004"
        },
        {
          "classification": "PRESERVATION",
          "line_number": 2,
          "line_sha256": "50705B00072D1B710BEC38F61F9539F3F354358A6ADCAEC2CA7EB41E9E3E421F",
          "record_id": "PRESERVE-WPUJAC104DWH-P005-L001-L004"
        },
        {
          "classification": "PRESERVATION",
          "line_number": 3,
          "line_sha256": "F9221730943F36538437ABB494D48281578181E93D2B1002B6E386344DE2E608",
          "record_id": "PRESERVE-WPUJAC104DWH-P005-L001-L004"
        },
        {
          "classification": "PRESERVATION",
          "line_number": 4,
          "line_sha256": "03C66C486784663ED19ACDB207D579D48D3373872254F94C2B709AA6132EBA9C",
          "record_id": "PRESERVE-WPUJAC104DWH-P005-L001-L004"
        },
        {
          "classification": "CHILD",
          "line_number": 5,
          "line_sha256": "D64C5BE7434972CC3F48EBABEBD425F36E4F90DD88747A2EC80904E166195503",
          "record_id": "CHILD-WPUJAC104DWH-P005-LEAK-001"
        },
        {
          "classification": "CHILD",
          "line_number": 6,
          "line_sha256": "ABF48EBB898B9AB35A9969A951A731C6D76E382238681C651B88906793946CD4",
          "record_id": "CHILD-WPUJAC104DWH-P005-LEAK-001"
        },
        {
          "classification": "CHILD",
          "line_number": 7,
          "line_sha256": "1B32B91FA63C0AC425436A368712E095C8461FAB872D0EBCAE29E345A4A64ADB",
          "record_id": "CHILD-WPUJAC104DWH-P005-LEAK-001"
        },
        {
          "classification": "PRESERVATION",
          "line_number": 8,
          "line_sha256": "4AA69A4C3932EFDDF003EB46C2F8E799E103CF87EB133BE3A169D71067459A02",
          "record_id": "PRESERVE-WPUJAC104DWH-P005-L008-L011"
        },
        {
          "classification": "PRESERVATION",
          "line_number": 9,
          "line_sha256": "D2CA4EAAEA75F92BE8418F5281B303AC3434D21A2D5B1E0195FF3133E5D8DFFB",
          "record_id": "PRESERVE-WPUJAC104DWH-P005-L008-L011"
        },
        {